{
  "$schema": "https://json-schema.org/draft/2020-12/schema",
  "$id": "https://local.hermes/contracts/agent-result.schema.json",
  "title": "AGENT_RESULT_JSON_V1",
  "type": "object",
  "required": [
    "resultVersion",
    "orderId",
    "executor",
    "status",
    "summary",
    "filesChanged",
    "artifacts",
    "proof",
    "selfReview",
    "scopeDeviations",
    "forbiddenPatternHits",
    "remainingRisks",
    "questions",
    "errors",
    "stdoutSummary",
    "stderrSummary"
  ],
  "properties": {
    "resultVersion": {
      "const": "AGENT_RESULT_JSON_V1"
    },
    "orderId": {
      "type": "string",
      "pattern": "^[A-Za-z0-9][A-Za-z0-9_-]{7,127}$"
    },
    "executor": {
      "enum": ["codex", "claude", "claudeFable", "agy", "hermes_delegate_task", "other"]
    },
    "status": {
      "enum": ["done", "blocked", "failed"]
    },
    "summary": {
      "type": "string"
    },
    "filesChanged": {
      "type": "array",
      "items": {
        "type": "object",
        "required": ["path", "action"],
        "properties": {
          "path": {
            "type": "string",
            "minLength": 1
          },
          "action": {
            "enum": ["added", "modified", "deleted", "renamed", "none"]
          }
        },
        "additionalProperties": true
      }
    },
    "artifacts": {
      "type": "array",
      "items": {
        "type": "object",
        "required": ["path", "exists", "type", "note"],
        "properties": {
          "path": {
            "type": "string",
            "minLength": 1
          },
          "exists": {
            "type": "boolean"
          },
          "type": {
            "type": "string"
          },
          "note": {
            "type": "string"
          },
          "mediaType": { "type": "string", "pattern": "^[A-Za-z0-9!#$&^_.+-]+/[A-Za-z0-9!#$&^_.+-]+(?:[\\t ]*;[^\\r\\n]*)?$" },
          "sha256": { "type": "string", "pattern": "^[0-9a-f]{64}$" }
        },
        "additionalProperties": true
      }
    },
    "proof": {
      "type": "array",
      "items": {
        "type": "object",
        "required": ["command", "cwd", "status", "exitCode", "summary"],
        "properties": {
          "command": {
            "type": "string",
            "minLength": 1
          },
          "cwd": {
            "type": "string",
            "minLength": 1
          },
          "status": {
            "enum": ["pass", "fail", "not_run"]
          },
          "exitCode": {
            "type": ["integer", "null"]
          },
          "summary": {
            "type": "string"
          }
        },
        "additionalProperties": true
      }
    },
    "selfReview": {
      "type": "object",
      "required": ["performed", "findings", "fixesApplied"],
      "properties": {
        "performed": {
          "type": "boolean"
        },
        "findings": {
          "type": "array",
          "items": {
            "type": "string"
          }
        },
        "fixesApplied": {
          "type": "array",
          "items": {
            "type": "string"
          }
        }
      },
      "additionalProperties": true
    },
    "executorExtensions": {
      "type": "object",
      "properties": {
        "review": {
          "type": "object",
          "required": ["verdict", "findings", "reviewedOrderId", "reviewedResultSha256", "productSnapshotSha256"],
          "properties": {
            "verdict": {"enum": ["pass", "fail", "blocked"]},
            "findings": {
              "type": "array",
              "items": {
                "type": "object",
                "required": ["criterion", "evidence"],
                "properties": {
                  "criterion": {"type": "string", "minLength": 1},
                  "evidence": {"type": "string", "minLength": 1}
                },
                "additionalProperties": true
              }
            },
            "reviewedOrderId": {"type": "string", "minLength": 1},
            "reviewedResultSha256": {"type": "string", "pattern": "^[0-9a-f]{64}$"},
            "productSnapshotSha256": {"type": "string", "pattern": "^[0-9a-f]{64}$"}
          },
          "additionalProperties": false
        }
      },
      "additionalProperties": true
    },
    "scopeDeviations": {
      "type": "array",
      "items": {
        "type": "string"
      }
    },
    "forbiddenPatternHits": {
      "type": "array",
      "items": {
        "type": "string"
      }
    },
    "remainingRisks": {
      "type": "array",
      "items": {
        "type": "string"
      }
    },
    "questions": {
      "type": "array",
      "items": {
        "type": "string"
      }
    },
    "errors": {
      "type": "array",
      "items": {
        "type": "string"
      }
    },
    "stdoutSummary": {
      "type": "string"
    },
    "stderrSummary": {
      "type": "string"
    },
    "handoff": {
      "type": "object",
      "required": ["version", "schemaId", "inReplyTo", "senderRole", "recipientRole"],
      "properties": {
        "version": { "const": "AGENT_HANDOFF_V1" },
        "schemaId": { "const": "AGENT_RESULT_JSON_V1" },
        "inReplyTo": { "type": "string", "minLength": 1 },
        "senderRole": { "type": "string", "minLength": 1 },
        "recipientRole": { "type": "string", "minLength": 1 },
        "objectiveId": { "type": "string", "minLength": 1 }
      },
      "additionalProperties": false
    },
    "responseEnvelope": {
      "type": "object",
      "required": [
        "version",
        "transport",
        "rawEvidencePath",
        "rawSha256",
        "rawBytes",
        "normalizedCandidatePath",
        "normalizedSha256",
        "normalizedBytes"
      ],
      "properties": {
        "version": { "const": "AGENT_RESPONSE_ENVELOPE_V1" },
        "transport": { "enum": ["raw_json", "json_fence"] },
        "rawEvidencePath": { "type": "string", "minLength": 1 },
        "rawSha256": { "type": "string", "pattern": "^[0-9a-f]{64}$" },
        "rawBytes": { "type": "integer", "minimum": 0 },
        "normalizedCandidatePath": { "type": "string", "minLength": 1 },
        "normalizedSha256": { "type": "string", "pattern": "^[0-9a-f]{64}$" },
        "normalizedBytes": { "type": "integer", "minimum": 0 }
      },
      "additionalProperties": false
    }
  },
  "allOf": [
    {
      "if": {
        "required": ["status"],
        "properties": {
          "status": {
            "const": "done"
          }
        }
      },
      "then": {
        "properties": {
          "proof": {
            "minItems": 1,
            "items": {
              "required": ["status"],
              "properties": {
                "status": {
                  "const": "pass"
                }
              }
            }
          },
          "selfReview": {
            "properties": {
              "performed": {
                "const": true
              }
            }
          },
          "scopeDeviations": {
            "maxItems": 0
          },
          "forbiddenPatternHits": {
            "maxItems": 0
          }
        }
      }
    }
  ],
  "additionalProperties": true
}
