{
  "resultVersion": "AGENT_RESULT_JSON_V1",
  "orderId": "centurion-v3-plan-review-20261016-r3",
  "executor": "claude",
  "status": "done",
  "summary": "Ревью выполнено только по приложенному PLAN.md (readOnlyInputs); прежние отзывы и старые исследования в оценку не включались, будущая работа N1–N8 не трактовалась как реализованная. Ключевые уточнения заказчика в плане сходятся: execution_state.py описан как read-only projection, изменяемое состояние отнесено к loopContract.statePath/LoopStateLock, Astra задана как high/xhigh с явной заменой прежнего xhigh floor в N2, V3 не обходится, бюджеты учитывают все inference и повторы (8 capability-проб + 48 запусков = 56), шесть пилотных миссий P1–P6 сопоставлены A-сценариям, версии product/policy/state/kit разделены, V0 не сводится к exit0, rollback не передаёт state 3.0 старому runtime, старые документы обозначены как исследовательские. Реальных блокеров перед стартом N1 нет. Найдены два major-дефекта текста плана в §5 (неопределённый критерий «не-Codex», задающий кто проверяет результат Opus, и внутренне противоречивая формулировка про Astra `medium`) и три minor-дефекта (отсутствие терминального состояния «явно остановленной» миссии, двойное употребление термина «сужение», отсутствие канонического идентификатора модели). Все они правятся точечными формулировками и не требуют изменения состава этапов. VERDICT: CHANGES_REQUESTED.",
  "stdoutSummary": "Заключение CHANGES_REQUESTED по итогам ручного разбора текста плана: два major и три minor замечания, блокеров перед N1 нет. Проверялся единственный кандидат candidateSha256=f8bf1c05470289eb33163bf074fea90e6a706899f649c0327b8ca872ac63878c, значение предоставлено контроллером в order; собственное вычисление хеша не выполнялось и не заявляется.",
  "stderrSummary": "",
  "filesChanged": [],
  "artifacts": [],
  "scopeDeviations": [],
  "forbiddenPatternHits": [],
  "remainingRisks": [
    "N7: агрегатный предел «общий максимум 56 inference-запусков и 5 часов wall time» не содержит явного резерва под 8 capability/проб; шесть миссий с лимитом 45 минут дают 270 минут из 300, поэтому обязательный пилот может быть остановлен агрегатным лимитом без превышения лимита отдельной миссии, а неполный пилот по правилам N7 «не считается принятым пилотом». Optional: зафиксировать порядок расходования или резерв времени под пробы.",
    "§6/N2 сохраняют mission-prep.mjs как второй эвристический источник routing-решений (необязательная рекомендация). Риск дрейфа с «одним репозиторным routing source» снимается только статусом «не выдаёт разрешений», что требует отдельного regression-покрытия найденных восьми случаев.",
    "Источники §2 (реестр R01–R25, исследование моделей, исторический план) и цитаты прежних отчётов не проверялись: они вне readOnlyInputs этого ревью.",
    "Реальные provider-маршруты, фактическое ограничение записи и выполнимость rollback остаются недоказанными до N7/N8; план это признаёт и не заявляет их реализованными."
  ],
  "questions": [],
  "errors": [],
  "proof": [
    {
      "command": "manual review of all supplied plan text; no commands, tests or tool invocations requested or performed",
      "cwd": "/tmp/centurion-v3-plan-a1ta6gn3/review-r3-workspace",
      "status": "pass",
      "exitCode": null,
      "summary": "Прочитан весь PLAN.md целиком, сверены §3/§4 (state и бюджеты), §5 (маршруты и floors), §7 N1–N8 (зависимости, приёмки, лимиты) и §8/§9 (сценарии и покрытие). Все замечания опираются на дословные фрагменты приложенного плана; команды не запускались, тесты не заявляются."
    }
  ],
  "selfReview": {
    "performed": true,
    "findings": [
      "F1 / major / дословно §5: «Содержательный пробел proof: для реализации Sol/Luna требуется независимый Opus. Для допустимого низкорискового не-Codex результата возможен Sol.» / Термин «не-Codex» больше нигде в плане не определён, но именно он решает, кто проверяет выход Opus на маршруте визуального дизайна (строка «Визуальный дизайн | Opus 5.5 high… с допустимой V1-проверкой Sol» и строка «Проверка низкорискового материала Opus»). При одном прочтении закрывается запланированный маршрут Opus→Sol V1 и миссия P3 пилота N7 остаётся без определённой проверки, при другом Sol начинает принимать результат Codex-семейства, то есть меняется verification floor, который N2 обязан закодировать. / Минимальная правка: заменить «не-Codex» явным предикатом — перечислить, какие адаптеры/семейства считаются Codex, и указать, что V1 через Sol допускается только для результата вне этого набора.",
      "F2 / major / дословно §5, строка Astra: «В первой 3.0 не расширять усилия до `medium`: прежний план предлагал его без локального proof» / Формулировка внутренне противоречива: `medium` ниже действующего уровня `high`, поэтому «расширять усилия до medium» одновременно запрещает и описывает medium как повышение. N2 по плану обязан «Внести матрицу §5… Astra high/xhigh… и version checks», но при буквальном чтении правила реализатор может ввести medium как допустимый уровень, что противоречит согласованной политике Astra 3.0 high/xhigh и ослабит её без отдельного решения. / Минимальная правка: «Astra `medium` не включается в политику 3.0; допустимы только `high` и `xhigh`».",
      "F3 / minor / дословно N8: «незавершённая миссия остаётся явно остановленной до отдельного решения, без автоматического replay» против §4: «Состояния миссии: `ready → running → verifying → completed`… `failed`» / В перечне состояний нет терминального состояния для «явно остановленной» миссии, тогда как на него опираются также §3 («незавершённый заказ сначала явно завершается/останавливается в прежнем режиме») и приёмка N4 («`failed/completed` не перезапускаются неявно»). N4 реализует переходы и не сможет отличить остановленную миссию от blocked/failed; неявный маппинг в `ready` при последующем решении владельца рискует стать автоматическим продолжением старого заказа. / Минимальная правка: добавить в §4 терминальное `stopped` (или явно указать, что остановка фиксируется как `failed` с записанным решением владельца) и отметить, что неявный перезапуск запрещён.",
      "F4 / minor / дословно A10: «Сужение путей или ослабление критерия | Сужение допустимо; ослабление/новая цель отвергнуты» против N4: «Пустое/суженное множество не доказывает выполнения цели: критерии проверяются независимо, а исчезновение необходимого результата блокирует приёмку» / Один термин «сужение» используется и как разрешённое действие (подмножество планируемых путей, §6: «подмножество путей допустимо, расширение цели нет»), и как недостаточное доказательство (суженный proof-набор). N3/N4 могут закодировать любое из прочтений, и приёмка A10 войдёт в конфликт с приёмкой N4. / Минимальная правка: развести термины: сокращение планируемой области работ допустимо; удаление значимого для критерия результата из proof-набора недопустимо и блокирует приёмку.",
      "F5 / minor / дословно §5: «Тимлид | GPT-6.1 Sol `high`, `xhigh` для трудных решений», «Узкая механическая работа | GPT-6 Luna `high`» против §2 «Sol 6.1 с инструментами требует Responses» и дальнейших упоминаний «Sol»/«Luna» / Канонический идентификатор модели не зафиксирован одним написанием, тогда как N2 требует «запреты недопустимых review-пар и version checks» и приёмку «неподдержанная модель/effort отвергается до launch», то есть посимвольное сравнение с routing source. Исполнитель вынужден угадывать строку модели, что даёт либо ложный отказ разрешённого маршрута, либо ложный допуск. / Минимальная правка: зафиксировать по одному каноническому идентификатору на модель и использовать его во всех упоминаниях, включая матрицу §5 и routing source."
    ],
    "fixesApplied": []
  }
}
